,description,medical_specialty,sample_name,transcription,keywords
2537," Total abdominal hysterectomy (TAH) and left salpingo-oophorectomy.  Hypermenorrhea, uterine fibroids, pelvic pain, left adnexal mass, and pelvic adhesions.", Obstetrics / Gynecology, TAH & Salpingo-oophorectomy ,"PREOPERATIVE DIAGNOSES:,1.  Hypermenorrhea.,2.  Uterine fibroids.,3.  Pelvic pain.,4.  Left adnexal mass.,5.  Pelvic adhesions.,POSTOPERATIVE DIAGNOSES:,1.  Hypermenorrhea.,2.  Uterine fibroids.,3.  Pelvic pain.,4.  Left adnexal mass.,5.  Pelvic adhesions.,PROCEDURE PERFORMED:,1.  Total abdominal hysterectomy (TAH).,2.  Left salpingo-oophorectomy.,ANESTHESIA:,  General endotracheal.,COMPLICATIONS:,  None.,ESTIMATED BLOOD LOSS: , Less than 100 cc.,INDICATIONS: , The patient is a 47-year-old Caucasian female with complaints of hypermenorrhea and pelvic pain, noted to have a left ovarian mass 7 cm at the time of laparoscopy in July of 2003.  The patient with continued symptoms of pelvic pain and hypermenorrhea and desired definitive surgical treatment.,FINDINGS AT THE TIME OF SURGERY: , Uterus is anteverted and boggy with a very narrow introitus with a palpable left adnexal mass.,On laparotomy, the uterus was noted to be slightly enlarged with fibroid change as well as a hemorrhagic appearing left adnexal mass.  The bowel, omentum, and appendix had a normal appearance.,PROCEDURE: , The patient was taken to the operative suite where anesthesia was found to be adequate.  She was then prepared and draped in normal sterile fashion.  A Pfannenstiel skin incision was made with a scalpel and carried through the underlying layer of fascia with the second scalpel.  The fascia was then incised in the midline.  The fascial incision was then extended laterally with Mayo scissors.  The superior aspect of the fascial incision was grasped with Kochers with the underlying rectus muscle dissected off bluntly and sharply with Mayo scissors.  Attention was then turned to the inferior aspect of this incision, which in a similar fashion was tented up with the underlying rectus muscle and dissected off bluntly and sharply with Mayo scissors.  The rectus muscle was then separated in the midline.  The peritoneum was identified, tented up with hemostats and entered sharply with Metzenbaum scissors.  The peritoneal incision was then extended superiorly and inferiorly with good visualization of the bladder.  The uterus and left adnexa were then palpated and brought out into the surgical field.  The fundus of the uterus was grasped with a Lahey clamp.  The GYN/Balfour retractor was placed.  The bladder blade was placed.  The bowel was packed away with moist laparotomy sponges and the extension through GYN/Balfour retractor was placed.  At this time, the patient's anatomy was surveyed and there was found to be a left hemorrhagic appearing adnexal mass.  Attention was first turned to the right round ligament, which was tented up with a Babcock and a small window was made beneath the round ligament with a hemostat.  It was then suture ligated with #0 Vicryl suture, transected with the broad ligament being skeletonized on both sides.  Next, the right ________ was isolated bluntly as the patient had a previous RSO.  This was then suture ligated with #0 Vicryl suture, doubly clamped with Kocher clamps, transected, and suture ligated with #0 Vicryl suture with a Heaney stitch.  Attention was then turned to the left round ligament, which was tented up with the Babcock.  Small window was made beneath it and the broad ligament with hemostat was then suture ligated with #0 Vicryl suture, transected, and skeletonized with the aid of Metzenbaums.  The left infundibulopelvic ligament was then bluntly isolated.  It was then suture ligated with #0 Vicryl suture, doubly clamped with Kocher clamps, and transected and suture ligated with #0 Vicryl suture with a Heaney stitch.  The bladder flap was then placed on tension with Allis clamps.  It was then dissected off of the lower uterine segment with the aid of Metzenbaum scissors and Russians.  It was then gently pushed off of lower uterine segment with the aid of a moist Ray-Tec.  The uterine arteries were then skeletonized bilaterally.,They were then clamped with straight Kocher clamps, transected, and suture ligated with #0 Vicryl suture.  The cardinal ligament and uterosacral complexes on both sides were then clamped with curved Kocher clamps.  These were then transected and suture ligated with #0 Vicryl suture.  The lower uterine segment was then grasped with Lahey clamps, at which time the cervix was already visible.  It was then entered with the last transection.  The cervix was grasped with a single-toothed tenaculum and the uterus, cervix, and left adnexa were amputated off the vagina with the aid of Jorgenson scissors.  The angles of the vaginal cuff were then grasped with Kocher clamps.  A Betadine-soaked Ray-Tec was then pushed into the vagina and the vaginal cuff was closed with #0 Vicryl suture in a running lock fashion with care taken to transect the ipsilateral cardinal ligament, at which time the suction tip was changed and copious suction irrigation was performed.  Good hemostasis was appreciated.  A figure-of-eight suture in the center of the vaginal cuff was placed with #0 Vicryl.  This was tagged for later use.  The uterosacrals on both sides were incorporated into the vaginal cuff with the aid of #0 Vicryl suture.  The round ligaments were then pulled into the vaginal cuff using the figure-of-eight suture placed in the center of the vaginal cuff and these were tied in place.  The pelvis was then again copiously suctioned irrigated and hemostasis was appreciated.  The peritoneal surfaces were then reapproximated with the aid of #3-0 Vicryl suture in a running fashion.  The GYN/Balfour retractor and bladder blade were then removed.  The bowel was then packed.  Again copious suction irrigation was performed with hemostasis appreciated.  The peritoneum was then reapproximated with #2-0 Vicryl suture in a running fashion.  The fascia was then reapproximated with #0 Vicryl suture in a running fashion.  The Scarpa's  fascia was then reapproximated with #3-0 plain gut in a running fashion and the skin was closed with #4-0 undyed Vicryl in a subcuticular fashion.  Steri-Strips were placed.  At the end of the procedure, the sponge that was pushed into the vagina previously was removed and hemostasis was appreciated vaginally.  The patient tolerated the procedure well and was taken to Recovery in stable condition.  Sponge, lap, and needle counts were correct x2.  Specimens include uterus, cervix, left fallopian tube, and ovary.", 
1900," Well-child check sports physical - Well child asthma with good control, allergic rhinitis.", Pediatrics - Neonatal, Sports Physical - 2 ,"CHIEF COMPLAINT:,  Well-child check sports physical.,HISTORY OF PRESENT ILLNESS:,  This is a 14-1/2-year-old white male known to have asthma and allergic rhinitis.  He is here with his mother for a well-child check.  Mother states he has been doing well with regard to his asthma and allergies.  He is currently on immunotherapy and also takes Advair 500/50 mg, Flonase, Claritin and albuterol inhaler as needed.  His last exacerbation was 04/04.  He has been very competitive in his sports this spring and summer and has had no issues since that time.  He eats well from all food groups.  He has very good calcium intake.  He will be attending Maize High School in the ninth grade.  He has same-sex and opposite-sex friends.  He has had a girlfriend in the past.  He denies any sexual activity.  No use of alcohol, cigarettes or other drugs.  His bowel movements are without problems.  His immunizations are up to date.  His last tetanus booster was in 07/03.,CURRENT MEDICATIONS:,  As above.,ALLERGIES: , He has no known medication allergies.,REVIEW OF SYSTEMS:,Constitutional:  He has had no fever.,HEENT:  No vision problems.  No eye redness, itching or drainage.  No earache.  No sore throat or congestion.,Cardiovascular:  No chest pain.,Respiratory:  No cough, shortness of breath or wheezing.,GI:  No stomachache, vomiting or diarrhea.,GU:  No dysuria, urgency or frequency.,Hematological:  No excessive bruising or bleeding.  He did have a minor concussion in 06/04 while playing baseball.,PHYSICAL EXAMINATION:,General:  He is alert and in no distress.,Vital signs:  He is afebrile.  His weight is at the 75th percentile.  His height is about the 80th percentile.,HEENT:  Normocephalic.  Atraumatic.  Pupils are equal, round and reactive to light.  TMs are clear bilaterally.  Nares patent.  Nasal mucosa is mildly edematous and pink.  No secretions.  Oropharynx is clear.,Neck:  Supple.,Lungs:  Good air exchange bilaterally.,Heart:  Regular.  No murmur.,Abdomen:  Soft.  Positive bowel sounds.  No masses.  No hepatosplenomegaly.,GU:  Male.  Testes descended bilaterally.  Tanner IV.  No hernia appreciated.,Extremities:  Symmetrical.  Femoral pulses 2+ bilaterally.  Full range of motion of all extremities.,Back:  No scoliosis.,Neurological:  Grossly intact.,Skin:  Normal turgor.  Minor sunburn on upper back.,Neurological:  Grossly intact.,ASSESSMENT:,1.  Well child.,2.  Asthma with good control.,3.  Allergic rhinitis, stable.,PLAN:,  Hearing and vision assessment today are both within normal limits.  Will check an H&H today.  Continue all medications as directed.  Prescription written for albuterol inhaler, #2, one for home and one for school to be used for rescue.  Anticipatory guidance for age.  He is to return to the office in one year or sooner if needed.",
355," Revision septoplasty, repair of internal nasal valve collapse using auricular cartilage, repair of bilateral external nasal valve collapse using auricular cartilage, harvest of right auricular cartilage.", Surgery, Septoplasty ,"PREOPERATIVE DIAGNOSES:,1.  Nasal septal deviation.,2.  Bilateral internal nasal valve collapse.,3.  Bilateral external nasal valve collapse.,POSTOPERATIVE DIAGNOSES:,1.  Nasal septal deviation.,2.  Bilateral internal nasal valve collapse.,3.  Bilateral external nasal valve collapse.,PROCEDURES:,1.  Revision septoplasty.,2.  Repair of internal nasal valve collapse using auricular cartilage.,3.  Repair of bilateral external nasal valve collapse using auricular cartilage.,4.  Harvest of right auricular cartilage.,ANESTHESIA: , General endotracheal anesthesia.,ESTIMATED BLOOD LOSS: , Approximately 20 mL.,IV FLUIDS: , Include a liter of crystalloid fluid.,URINE OUTPUT: , None.,FINDINGS: , Include that of significantly deviated septum with postoperative changes and a significant septal spur along the floor.  There is also evidence of bilateral internal as well as external nasal valve collapse.,INDICATIONS:  ,The patient is a pleasant 49-year-old gentleman who had undergone a previous septorhinoplasty after significant trauma in his 20s.  He now presents with significant upper airway resistance and nasal obstruction and is unable to tolerate a CPAP machine.  Therefore, for repair of the above-mentioned deformities including the internal and external nasal valve collapse as well as straightening of the deviated septum, the risks and benefits of the procedure were discussed with him included but not limited to bleeding, infection, septal perforation, need for further surgeries, external deformity, and he desired to proceed with surgery.,DESCRIPTION OF THE PROCEDURE IN DETAIL:  ,The patient was taken to the operating room and laid supine upon the OR table.  After the induction of general endotracheal anesthesia, the nose was decongested using Afrin-soaked pledgets followed by the injection of % lidocaine with 1:100,000 epinephrine in the submucoperichondrial planes bilaterally.  Examination revealed significant deviation of the nasal septum and the bony cartilaginous junction as well as the large septal spur along the floor.  The caudal septum appeared to be now in adequate position.  There was evidence that there had been a previous caudal septal graft on the right nares and it was decided to leave this in place.  Following the evaluation of the nose, a hemitransfixion incision was made on the left revealing a large septal spur consisting primarily down on the floor of the left nostril creating nearly a picture of the vestibular stenosis on the side.  Very carefully, the mucoperichondrial flaps were elevated over this, and it was excised using an osteotome taking care to preserve the 1.5 cm dorsal and caudal strap of the nasal septum and keep it attached to the nasal spine.  Very carefully, the bony cartilaginous junction was identified and a small piece of the bone, where the spur was, was carefully removed.  Following this, it was noted that the cartilaginous region was satisfactory in quantity as well as quality to perform adequate grafting procedures.  Therefore, attention was turned to harvesting the right-sided auricular cartilage, which was done after the region had adequately been prepped and draped in a sterile fashion.  Postauricular incision using a #15 blade, the area of the submucoperichondrial plane was elevated in order to preserve the nice lining and identifiable portion of the cartilage taking care to preserve the ridge of the helix at all times.  This was very carefully harvested.  This area had been injected previously with 1% lidocaine and 1:100,000 epinephrine.  Following this, the cartilage was removed.  It was placed in saline, noted to be fashioned in the bilateral spreader graft and alar rim graft as well as a small piece of crush which was used to be placed along the top of the dorsal irregularity.  The spreader grafts were sutured in place using submucoperichondrial pockets.  After an external septorhinoplasty approach had been performed and reflection of the skin and soft tissue envelope had been performed, adequately revealing straight septum with significant narrowing with what appeared to be detached perhaps from his ipsilateral cartilages rather from his previous surgery.  These were secured in place in the pockets using a 5-0 PDS suture in a mattress fashion in two places.  Following this, attention was turned to placing the alar rim grafts where pockets were created along the caudal aspect of the lower lateral cartilage and just along the alar margin.  Subsequently, the alar rim grafts were placed and extended all the way to the piriform aperture.  This was sutured in place using a 5-0 self-absorbing gut suture.  The lower lateral cartilage has had some inherent asymmetry.  This may have been related to his previous surgery with some asymmetry of the dome; however, this was left in place as he did not desire any changes in the tip region, and there was adequate support.  An endodermal suture was placed just to reenforce the region using a 5-0 PDS suture.  Following all this, the area was closed using a mattress 4-0 plain gut on a Keith needle followed by the application of ***** 5-0 fast-absorbing gut to close the hemitransfixion incision.  Very carefully, the skin and subcutaneous tissue envelopes were reflected.  The curvilinear incision was closed using a Vicryl followed by interrupted 6-0 Prolene sutures.  The marginal incisions were then closed using 5-0 fast-absorbing gut.  Doyle splints were placed and secured down using a nylon suture.  They had ointment also placed on them.  Following this, nasopharynx was suctioned.  There were no further abnormalities noted and everything appeared to be in nice position.  Therefore, an external splint was placed after the application of Steri-Strips.  The patient tolerated the procedure well.  He was awakened in the operating room.  He was extubated and taken to the recovery room in stable condition.","surgery, nasal septal deviation, nasal septal, auricular cartilage, nasal, nasal obstruction, nasal valve, septoplasty, submucoperichondrial, upper airway, internal nasal valve, external nasal valve, hemitransfixion incision, revision septoplasty, septal spur, valve collapse, auricular, cartilage, collapse, septum, valve, "
1175," Bilateral myringotomies, placement of ventilating tubes, nasal endoscopy, and adenoidectomy.", Surgery, Bilateral Myringotomies ,"PREOPERATIVE DIAGNOSES,1.  Recurrent acute otitis media, bilateral middle ear effusions.,2.  Chronic rhinitis.,3.  Recurrent adenoiditis with adenoid hypertrophy.,POSTOPERATIVE DIAGNOSES,1.  Recurrent acute otitis media, bilateral middle ear effusions.,2.  Chronic rhinitis.,3.  Recurrent adenoiditis with adenoid hypertrophy.,FINAL DIAGNOSES,1.  Recurrent acute otitis media, bilateral middle ear effusions.,2.  Chronic rhinitis.,3.  Recurrent adenoiditis with adenoid hypertrophy.,4.  Acute and chronic adenoiditis.,OPERATIONS PERFORMED,1.  Bilateral myringotomies.,2.  Placement of ventilating tubes.,3.  Nasal endoscopy.,4.  Adenoidectomy.,DESCRIPTION OF OPERATIONS: , The patient was brought to the operating room, endotracheal intubation carried out by Dr. X. Both sides of the patient's nose were then sprayed with Afrin.  Ears were inspected then with the operating microscope.  The anterior inferior quadrant myringotomy incisions were performed.  Then, a modest amount of serous and a trace of mucoid material encountered that was evacuated.  The middle ear mucosa looked remarkably clean.  Armstrong tubes were inserted.  Ciprodex drops were instilled.  Ciprodex will be planned for two postoperative days as well.  Nasal endoscopy was carried out, and evidence of acute purulent adenoiditis was evident in spite of the fact that clinically the patient has shown some modest improvement following cessation of all milk products.  The adenoids were shaved back, flushed with curette through a traditional transoral route with thick purulent material emanating from the crypts, and representative cultures were taken.  Additional adenoid tissue was shaved backwards with the RADenoid shaver.  Electrocautery was used to establish hemostasis, and repeat nasal endoscopy accomplished.  The patient still had residual evidence of inter choanal adenoid tissue, and video photos were taken.  That remaining material was resected, guided by the nasal endoscope using the RADenoid shaver to remove the material and flush with the posterior nasopharynx.  Electrocautery again used to establish hemostasis.  Bleeding was trivial.  Extensive irrigation accomplished.  No additional bleeding was evident.  The patient was awakened, extubated, taken to the recovery room in a stable condition.  Discharge anticipated later in the day on Augmentin 400 mg twice daily, Lortab or Tylenol p.r.n. for pain.  Office recheck would be anticipated if stable and doing well in approximately two weeks.  Parents were instructed to call, however, regarding the outcome of the culture on Monday next week to ensure adequate antibiotic coverage before cessation of the antibiotic.","surgery, bilateral middle ear effusions, recurrent acute otitis media, chronic rhinitis, recurrent adenoiditis with adenoid hypertrophy, adenoiditis, bilateral myringotomies, ventilating tubes, nasal endoscopy, adenoidectomy, adenoid hypertrophy, myringotomies, otitis, media, hypertrophy, endoscopy, intubation, nasal,"
